{
  "$schema": "https://json-schema.org/draft/2020-12/schema",
  "$id": "https://github.com/latif-erdogdu/academic-thesis-writer/schemas/research_question.json",
  "title": "Arastirma Sorusu",
  "description": "Tezin ana arastirma sorusu veya alt sorusu tanimi.",
  "type": "object",
  "additionalProperties": false,
  "required": ["id", "text", "type", "status"],
  "examples": [
    {
      "$comment": "KURGUSAL ORNEK. Soru uydurmadir.",
      "id": "RQ-001",
      "text": "Kurgusal ornek arastirma sorusu: yontemin etkisi nedir?",
      "type": "main",
      "chapter": "CH-001",
      "method": "Kurgusal yontem",
      "status": "pending",
      "hypothesis_ids": ["HYP-001"],
      "related_claims": ["CLM-001"],
      "related_findings": [],
      "finding_ids": [],
      "answered_by": [],
      "notes": ""
    }
  ],
  "properties": {
    "$comment": { "type": "string" },
    "id": { "type": "string", "pattern": "^RQ-\\d{3,}$" },
    "text": { "type": "string", "minLength": 1 },
    "type": { "enum": ["main", "sub"] },
    "chapter": { "type": "string", "pattern": "^CH-\\d{3,}$" },
    "method": { "type": "string" },
    "status": {
      "enum": ["answered", "pending", "partially_answered", "dropped"]
    },
    "hypothesis_ids": {
      "type": "array", "items": { "type": "string", "pattern": "^HYP-\\d{3,}$" }
    },
    "related_claims": {
      "type": "array", "items": { "type": "string", "pattern": "^CLM-\\d{3,}$" }
    },
    "related_findings": {
      "type": "array", "items": { "type": "string", "pattern": "^FND-\\d{3,}$" }
    },
    "finding_ids": {
      "type": "array", "items": { "type": "string", "pattern": "^FND-\\d{3,}$" }
    },
    "answered_by": {
      "type": "array", "items": { "type": "string", "pattern": "^FND-\\d{3,}$" }
    },
    "notes": { "type": "string" }
  }
}
